23:02:13.795413 IP 50-201-125-10-static.hfc.comcastbusiness.net.https > 192.168.0.101.56943: UDP, length 109
23:02:13.795695 IP 50-201-125-10-static.hfc.comcastbusiness.net.https > 192.168.0.101.56943: UDP, length 93
23:02:14.481501 IP 192.168.0.101.56943 > 50-201-125-10-static.hfc.comcastbusiness.net.https: UDP, length 93
23:02:14.536324 IP 192.168.0.101.56943 > 50-201-125-10-static.hfc.comcastbusiness.net.https: UDP, length 125
23:02:14.801018 IP 192.168.0.101.53482 > 50-201-125-10-static.hfc.comcastbusiness.net.https: Flags [P.], seq 2994794511:2994794580, ack 1756193754, win 65535, options [nop,nop,TS val 64968941 ecr 442382183], length 69
23:02:14.843294 IP 50-201-125-10-static.hfc.comcastbusiness.net.https > 192.168.0.101.56943: UDP, length 109
23:02:14.843940 IP 50-201-125-10-static.hfc.comcastbusiness.net.https > 192.168.0.101.56943: UDP, length 557
23:02:14.996001 IP 192.168.0.101.56943 > 50-201-125-10-static.hfc.comcastbusiness.net.https: UDP, length 141
23:02:15.040912 IP 50-201-125-10-static.hfc.comcastbusiness.net.https > 192.168.0.101.53482: Flags [.], ack 69, win 32768, options [nop,nop,TS val 442392171 ecr 64968941], length 0
23:02:15.040914 IP 50-201-125-10-static.hfc.comcastbusiness.net.https > 192.168.0.101.53482: Flags [P.], seq 1:70, ack 69, win 32768, options [nop,nop,TS val 442392171 ecr 0], length 69
23:02:15.040970 IP 192.168.0.101.53482 > 50-201-125-10-static.hfc.comcastbusiness.net.https: Flags [.], ack 70, win 65535, options [nop,nop,TS val 64969179 ecr 442392171], length 0
23:02:15.536748 IP 50-201-125-10-static.hfc.comcastbusiness.net.https > 192.168.0.101.56943: UDP, length 141
23:02:15.771473 IP 192.168.0.101.56943 > 50-201-125-10-static.hfc.comcastbusiness.net.https: UDP, length 125
23:02:15.843108 IP 192.168.0.101.56943 > 50-201-125-10-static.hfc.comcastbusiness.net.https: UDP, length 109
23:02:16.026530 IP 50-201-125-10-static.hfc.comcastbusiness.net.https > 192.168.0.101.56943: UDP, length 125
23:02:16.027028 IP 192.168.0.101.56943 > 50-201-125-10-static.hfc.comcastbusiness.net.https: UDP, length 109
23:02:16.027147 IP 192.168.0.101.56943 > 50-201-125-10-static.hfc.comcastbusiness.net.https: UDP, length 109
23:02:16.030660 IP 192.168.0.101.56943 > 50-201-125-10-static.hfc.comcastbusiness.net.https: UDP, length 125
23:02:16.093529 IP 192.168.0.101.56943 > 50-201-125-10-static.hfc.comcastbusiness.net.https: UDP, length 109
23:02:16.113508 IP 50-201-125-10-static.hfc.comcastbusiness.net.https > 192.168.0.101.56943: UDP, length 125
23:02:16.274764 IP 50-201-125-10-static.hfc.comcastbusiness.net.https > 192.168.0.101.56943: UDP, length 109
23:02:16.275467 IP 50-201-125-10-static.hfc.comcastbusiness.net.https > 192.168.0.101.56943: UDP, length 93
23:02:16.278923 IP 50-201-125-10-static.hfc.comcastbusiness.net.https > 192.168.0.101.56943: UDP, length 125
23:02:16.279199 IP 192.168.0.101.56943 > 50-201-125-10-static.hfc.comcastbusiness.net.https: UDP, length 109
23:02:16.279340 IP 192.168.0.101.56943 > 50-201-125-10-static.hfc.comcastbusiness.net.https: UDP, length 253
23:02:16.293591 IP 50-201-125-10-static.hfc.comcastbusiness.net.https > 192.168.0.101.56943: UDP, length 845
23:02:16.293925 IP 192.168.0.101.56943 > 50-201-125-10-static.hfc.comcastbusiness.net.https: UDP, length 109
23:02:16.363342 IP 50-201-125-10-static.hfc.comcastbusiness.net.https > 192.168.0.101.56943: UDP, length 125
23:02:16.527385 IP 50-201-125-10-static.hfc.comcastbusiness.net.https > 192.168.0.101.56943: UDP, length 573
23:02:16.528028 IP 192.168.0.101.56943 > 50-201-125-10-static.hfc.comcastbusiness.net.https: UDP, length 109
23:02:16.534746 IP 192.168.0.101.56943 > 50-201-125-10-static.hfc.comcastbusiness.net.https: UDP, length 1469
23:02:16.535385 IP 192.168.0.101.56943 > 50-201-125-10-static.hfc.comcastbusiness.net.https: UDP, length 349
23:02:16.622872 IP 192.168.0.101.56943 > 50-201-125-10-static.hfc.comcastbusiness.net.https: UDP, length 61
23:02:16.623581 IP 192.168.0.101.53482 > 50-201-125-10-static.hfc.comcastbusiness.net.https: Flags [P.], seq 69:186, ack 70, win 65535, options [nop,nop,TS val 64970700 ecr 442392171], length 117
23:02:16.623788 IP 192.168.0.101.53482 > 50-201-125-10-static.hfc.comcastbusiness.net.https: Flags [F.], seq 186, ack 70, win 65535, options [nop,nop,TS val 64970700 ecr 442392171], length 0
23:02:16.758978 IP 50-201-125-10-static.hfc.comcastbusiness.net.https > 192.168.0.101.56943: UDP, length 141
23:02:16.783016 IP 50-201-125-10-static.hfc.comcastbusiness.net.https > 192.168.0.101.56943: UDP, length 109
23:02:16.783578 IP 50-201-125-10-static.hfc.comcastbusiness.net.https > 192.168.0.101.56943: UDP, length 285
23:02:16.861100 IP 50-201-125-10-static.hfc.comcastbusiness.net.https > 192.168.0.101.53482: Flags [.], ack 186, win 32768, options [nop,nop,TS val 442393993 ecr 64970700], length 0
23:02:16.861703 IP 50-201-125-10-static.hfc.comcastbusiness.net.https > 192.168.0.101.53482: Flags [.], ack 187, win 32768, options [nop,nop,TS val 442393994 ecr 0], length 0
23:02:16.862118 IP 50-201-125-10-static.hfc.comcastbusiness.net.https > 192.168.0.101.53482: Flags [P.], seq 70:155, ack 187, win 32768, options [nop,nop,TS val 442393994 ecr 0], length 85
23:02:16.862119 IP 50-201-125-10-static.hfc.comcastbusiness.net.https > 192.168.0.101.53482: Flags [FP.], seq 155, ack 187, win 32768, options [nop,nop,TS val 442393994 ecr 0], length 0
23:02:16.862164 IP 192.168.0.101.53482 > 50-201-125-10-static.hfc.comcastbusiness.net.https: Flags [R], seq 2994794698, win 0, length 0
23:02:28.286339 IP 192.168.0.101.59631 > ec2-54-148-61-193.us-west-2.compute.amazonaws.com.https: Flags [SEW], seq 2621248403, win 65535, options [mss 1460,nop,wscale 5,nop,nop,TS val 64981957 ecr 0,sackOK,eol], length 0
23:02:28.316889 IP 192.168.0.101.49620 > sc-in-f189.1e100.net.https: UDP, length 1350
23:02:28.317160 IP 192.168.0.101.49620 > sc-in-f189.1e100.net.https: UDP, length 1292
23:02:28.359174 IP sc-in-f189.1e100.net.https > 192.168.0.101.49620: UDP, length 1350
23:02:28.359177 IP sc-in-f189.1e100.net.https > 192.168.0.101.49620: UDP, length 1350
23:02:28.359609 IP 192.168.0.101.49620 > sc-in-f189.1e100.net.https: UDP, length 38
23:02:28.360171 IP sc-in-f189.1e100.net.https > 192.168.0.101.49620: UDP, length 1350
23:02:28.362170 IP 192.168.0.101.49620 > sc-in-f189.1e100.net.https: UDP, length 1350
23:02:28.362202 IP 192.168.0.101.49620 > sc-in-f189.1e100.net.https: UDP, length 1288
23:02:28.382557 IP sc-in-f189.1e100.net.https > 192.168.0.101.49620: UDP, length 35
23:02:28.387529 IP 192.168.0.101.49620 > sc-in-f189.1e100.net.https: UDP, length 38
23:02:28.404212 IP sc-in-f189.1e100.net.https > 192.168.0.101.49620: UDP, length 1350
23:02:28.404215 IP sc-in-f189.1e100.net.https > 192.168.0.101.49620: UDP, length 31
23:02:28.404216 IP sc-in-f189.1e100.net.https > 192.168.0.101.49620: UDP, length 33
23:02:28.404585 IP 192.168.0.101.49620 > sc-in-f189.1e100.net.https: UDP, length 41
23:02:28.404668 IP 192.168.0.101.49620 > sc-in-f189.1e100.net.https: UDP, length 38
23:02:28.444929 IP sc-in-f189.1e100.net.https > 192.168.0.101.49620: UDP, length 30
23:02:28.486252 IP 192.168.0.101.59632 > ec2-54-148-61-193.us-west-2.compute.amazonaws.com.https: Flags [SEW], seq 2522174445, win 65535, options [mss 1460,nop,wscale 5,nop,nop,TS val 64982139 ecr 0,sackOK,eol], length 0
23:02:29.369581 IP 192.168.0.101.59631 > ec2-54-148-61-193.us-west-2.compute.amazonaws.com.https: Flags [S], seq 2621248403, win 65535, options [mss 1460,nop,wscale 5,nop,nop,TS val 64982957 ecr 0,sackOK,eol], length 0
23:02:29.546508 IP sc-in-f189.1e100.net.https > 192.168.0.101.49620: UDP, length 450
23:02:29.546511 IP sc-in-f189.1e100.net.https > 192.168.0.101.49620: UDP, length 38
23:02:29.546781 IP 192.168.0.101.49620 > sc-in-f189.1e100.net.https: UDP, length 44
23:02:29.559666 IP 192.168.0.101.59632 > ec2-54-148-61-193.us-west-2.compute.amazonaws.com.https: Flags [S], seq 2522174445, win 65535, options [mss 1460,nop,wscale 5,nop,nop,TS val 64983139 ecr 0,sackOK,eol], length 0
23:02:30.232260 IP 192.168.0.101.59635 > ec2-54-148-61-193.us-west-2.compute.amazonaws.com.https: Flags [SEW], seq 1417370303, win 65535, options [mss 1460,nop,wscale 5,nop,nop,TS val 64983786 ecr 0,sackOK,eol], length 0
23:02:30.409640 IP 192.168.0.101.59631 > ec2-54-148-61-193.us-west-2.compute.amazonaws.com.https: Flags [S], seq 2621248403, win 65535, options [mss 1460,nop,wscale 5,nop,nop,TS val 64983957 ecr 0,sackOK,eol], length 0
23:02:30.603160 IP 192.168.0.101.59632 > ec2-54-148-61-193.us-west-2.compute.amazonaws.com.https: Flags [S], seq 2522174445, win 65535, options [mss 1460,nop,wscale 5,nop,nop,TS val 64984140 ecr 0,sackOK,eol], length 0
23:02:31.283566 IP 192.168.0.101.59635 > ec2-54-148-61-193.us-west-2.compute.amazonaws.com.https: Flags [S], seq 1417370303, win 65535, options [mss 1460,nop,wscale 5,nop,nop,TS val 64984786 ecr 0,sackOK,eol], length 0
23:02:31.467496 IP 192.168.0.101.59631 > ec2-54-148-61-193.us-west-2.compute.amazonaws.com.https: Flags [S], seq 2621248403, win 65535, options [mss 1460,nop,wscale 5,nop,nop,TS val 64984957 ecr 0,sackOK,eol], length 0
23:02:31.655998 IP 192.168.0.101.59632 > ec2-54-148-61-193.us-west-2.compute.amazonaws.com.https: Flags [S], seq 2522174445, win 65535, options [mss 1460,nop,wscale 5,nop,nop,TS val 64985140 ecr 0,sackOK,eol], length 0
23:02:32.335191 IP 192.168.0.101.59635 > ec2-54-148-61-193.us-west-2.compute.amazonaws.com.https: Flags [S], seq 1417370303, win 65535, options [mss 1460,nop,wscale 5,nop,nop,TS val 64985786 ecr 0,sackOK,eol], length 0
23:02:32.479223 IP 192.168.0.101.59637 > 40.101.12.82.https: Flags [SEW], seq 3515784705, win 65535, options [mss 1460,nop,wscale 5,nop,nop,TS val 64985920 ecr 0,sackOK,eol], length 0
23:02:32.479330 IP 192.168.0.101.59638 > 40.101.12.82.https: Flags [SEW], seq 3142038228, win 65535, options [mss 1460,nop,wscale 5,nop,nop,TS val 64985920 ecr 0,sackOK,eol], length 0
23:02:32.496400 IP 192.168.0.101.59639 > 40.101.12.82.https: Flags [S], seq 2159039595, win 65535, options [mss 1460,nop,wscale 5,nop,nop,TS val 64985935 ecr 0,sackOK,eol], length 0
23:02:32.520407 IP 192.168.0.101.59631 > ec2-54-148-61-193.us-west-2.compute.amazonaws.com.https: Flags [S], seq 2621248403, win 65535, options [mss 1460,nop,wscale 5,nop,nop,TS val 64985957 ecr 0,sackOK,eol], length 0
23:02:32.624165 IP 40.101.12.82.https > 192.168.0.101.59638: Flags [S.], seq 2634501326, ack 3142038229, win 8190, options [mss 1460,nop,wscale 4,nop,nop,sackOK], length 0
23:02:32.624169 IP 40.101.12.82.https > 192.168.0.101.59637: Flags [S.], seq 372922836, ack 3515784706, win 8190, options [mss 1460,nop,wscale 4,nop,nop,sackOK], length 0
23:02:32.624251 IP 192.168.0.101.59638 > 40.101.12.82.https: Flags [.], ack 1, win 8192, length 0
23:02:32.624274 IP 192.168.0.101.59637 > 40.101.12.82.https: Flags [.], ack 1, win 8192, length 0
23:02:32.624473 IP 192.168.0.101.59638 > 40.101.12.82.https: Flags [P.], seq 1:242, ack 1, win 8192, length 241
23:02:32.624621 IP 192.168.0.101.59637 > 40.101.12.82.https: Flags [P.], seq 1:242, ack 1, win 8192, length 241
23:02:32.642292 IP 40.101.12.82.https > 192.168.0.101.59639: Flags [S.], seq 4156906709, ack 2159039596, win 8190, options [mss 1460,nop,wscale 4,nop,nop,sackOK], length 0
23:02:32.642364 IP 192.168.0.101.59639 > 40.101.12.82.https: Flags [.], ack 1, win 8192, length 0
23:02:32.715109 IP 192.168.0.101.59632 > ec2-54-148-61-193.us-west-2.compute.amazonaws.com.https: Flags [S], seq 2522174445, win 65535, options [mss 1460,nop,wscale 5,nop,nop,TS val 64986140 ecr 0,sackOK,eol], length 0
23:02:32.769287 IP 40.101.12.82.https > 192.168.0.101.59638: Flags [.], ack 242, win 679, length 0
23:02:32.769688 IP 40.101.12.82.https > 192.168.0.101.59637: Flags [.], ack 242, win 679, length 0
23:02:32.772123 IP 40.101.12.82.https > 192.168.0.101.59638: Flags [.], seq 1:1461, ack 242, win 65535, length 1460
23:02:32.772393 IP 40.101.12.82.https > 192.168.0.101.59638: Flags [.], seq 1461:2921, ack 242, win 65535, length 1460
23:02:32.772395 IP 40.101.12.82.https > 192.168.0.101.59638: Flags [P.], seq 2921:3892, ack 242, win 65535, length 971
23:02:32.772441 IP 192.168.0.101.59638 > 40.101.12.82.https: Flags [.], ack 2921, win 8146, length 0
23:02:32.772463 IP 192.168.0.101.59638 > 40.101.12.82.https: Flags [.], ack 3892, win 8116, length 0
23:02:32.772810 IP 40.101.12.82.https > 192.168.0.101.59637: Flags [.], seq 1:1461, ack 242, win 65535, length 1460
23:02:32.772814 IP 40.101.12.82.https > 192.168.0.101.59637: Flags [.], seq 1461:2921, ack 242, win 65535, length 1460
23:02:32.772817 IP 40.101.12.82.https > 192.168.0.101.59637: Flags [P.], seq 2921:3892, ack 242, win 65535, length 971
23:02:32.772903 IP 192.168.0.101.59637 > 40.101.12.82.https: Flags [.], ack 2921, win 8100, length 0
23:02:32.772935 IP 192.168.0.101.59637 > 40.101.12.82.https: Flags [.], ack 3892, win 8070, length 0
23:02:32.773708 IP 192.168.0.101.59638 > 40.101.12.82.https: Flags [P.], seq 242:368, ack 3892, win 8192, length 126
23:02:32.773766 IP 192.168.0.101.59637 > 40.101.12.82.https: Flags [.], ack 3892, win 8192, length 0
23:02:32.774622 IP 192.168.0.101.59637 > 40.101.12.82.https: Flags [P.], seq 242:368, ack 3892, win 8192, length 126
23:02:32.918949 IP 40.101.12.82.https > 192.168.0.101.59638: Flags [P.], seq 3892:3943, ack 368, win 65535, length 51
23:02:32.919008 IP 192.168.0.101.59638 > 40.101.12.82.https: Flags [.], ack 3943, win 8190, length 0
23:02:32.920218 IP 40.101.12.82.https > 192.168.0.101.59637: Flags [P.], seq 3892:3943, ack 368, win 65535, length 51
23:02:32.920266 IP 192.168.0.101.59637 > 40.101.12.82.https: Flags [.], ack 3943, win 8190, length 0
23:02:32.926670 IP 192.168.0.101.59638 > 40.101.12.82.https: Flags [P.], seq 368:798, ack 3943, win 8192, length 430
23:02:32.926736 IP 192.168.0.101.59637 > 40.101.12.82.https: Flags [P.], seq 368:798, ack 3943, win 8192, length 430
23:02:33.072466 IP 40.101.12.82.https > 192.168.0.101.59638: Flags [P.], seq 3943:4352, ack 798, win 65535, length 409
23:02:33.072469 IP 40.101.12.82.https > 192.168.0.101.59637: Flags [P.], seq 3943:4352, ack 798, win 65535, length 409
23:02:33.072543 IP 192.168.0.101.59638 > 40.101.12.82.https: Flags [.], ack 4352, win 8179, length 0
23:02:33.072567 IP 192.168.0.101.59637 > 40.101.12.82.https: Flags [.], ack 4352, win 8179, length 0
23:02:33.093565 IP 192.168.0.101.59642 > 13.107.18.11.https: Flags [S], seq 1087917290, win 65535, options [mss 1460,nop,wscale 5,nop,nop,TS val 64986504 ecr 0,sackOK,eol], length 0
23:02:33.118849 IP 13.107.18.11.https > 192.168.0.101.59642: Flags [S.], seq 2811453067, ack 1087917291, win 8192, options [mss 1440,nop,wscale 8,sackOK,TS val 560634399 ecr 64986504], length 0
23:02:33.118919 IP 192.168.0.101.59642 > 13.107.18.11.https: Flags [.], ack 1, win 4105, options [nop,nop,TS val 64986529 ecr 560634399], length 0
23:02:33.119074 IP 192.168.0.101.59642 > 13.107.18.11.https: Flags [P.], seq 1:207, ack 1, win 4105, options [nop,nop,TS val 64986529 ecr 560634399], length 206
23:02:33.144048 IP 13.107.18.11.https > 192.168.0.101.59642: Flags [.], ack 207, win 1029, options [nop,nop,TS val 560634424 ecr 64986529], length 0
23:02:33.147803 IP 13.107.18.11.https > 192.168.0.101.59642: Flags [.], seq 1:1449, ack 207, win 1029, options [nop,nop,TS val 560634426 ecr 64986529], length 1448
23:02:33.147806 IP 13.107.18.11.https > 192.168.0.101.59642: Flags [.], seq 1449:2897, ack 207, win 1029, options [nop,nop,TS val 560634426 ecr 64986529], length 1448
23:02:33.147807 IP 13.107.18.11.https > 192.168.0.101.59642: Flags [.], seq 2897:4345, ack 207, win 1029, options [nop,nop,TS val 560634426 ecr 64986529], length 1448
23:02:33.147808 IP 13.107.18.11.https > 192.168.0.101.59642: Flags [P.], seq 4345:5402, ack 207, win 1029, options [nop,nop,TS val 560634426 ecr 64986529], length 1057
23:02:33.147932 IP 192.168.0.101.59642 > 13.107.18.11.https: Flags [.], ack 2897, win 4015, options [nop,nop,TS val 64986556 ecr 560634426], length 0
23:02:33.147942 IP 192.168.0.101.59642 > 13.107.18.11.https: Flags [.], ack 5402, win 3936, options [nop,nop,TS val 64986556 ecr 560634426], length 0
23:02:33.147971 IP 192.168.0.101.59642 > 13.107.18.11.https: Flags [.], ack 5402, win 4096, options [nop,nop,TS val 64986556 ecr 560634426], length 0
23:02:33.148586 IP 192.168.0.101.59642 > 13.107.18.11.https: Flags [P.], seq 207:300, ack 5402, win 4096, options [nop,nop,TS val 64986556 ecr 560634426], length 93
23:02:33.173295 IP 13.107.18.11.https > 192.168.0.101.59642: Flags [.], ack 300, win 1029, options [nop,nop,TS val 560634454 ecr 64986556], length 0
23:02:33.173769 IP 13.107.18.11.https > 192.168.0.101.59642: Flags [P.], seq 5402:5453, ack 300, win 1029, options [nop,nop,TS val 560634454 ecr 64986556], length 51
23:02:33.173816 IP 192.168.0.101.59642 > 13.107.18.11.https: Flags [.], ack 5453, win 4094, options [nop,nop,TS val 64986578 ecr 560634454], length 0
23:02:33.173948 IP 13.107.18.11.https > 192.168.0.101.59642: Flags [P.], seq 5453:5522, ack 300, win 1029, options [nop,nop,TS val 560634454 ecr 64986556], length 69
23:02:33.173968 IP 192.168.0.101.59642 > 13.107.18.11.https: Flags [.], ack 5522, win 4092, options [nop,nop,TS val 64986578 ecr 560634454], length 0
23:02:33.174222 IP 192.168.0.101.59642 > 13.107.18.11.https: Flags [P.], seq 300:393, ack 5522, win 4092, options [nop,nop,TS val 64986578 ecr 560634454], length 93
23:02:33.174494 IP 192.168.0.101.59642 > 13.107.18.11.https: Flags [P.], seq 393:431, ack 5522, win 4096, options [nop,nop,TS val 64986579 ecr 560634454], length 38
23:02:33.174708 IP 192.168.0.101.59642 > 13.107.18.11.https: Flags [.], seq 431:1859, ack 5522, win 4096, options [nop,nop,TS val 64986579 ecr 560634454], length 1428
23:02:33.174723 IP 192.168.0.101.59642 > 13.107.18.11.https: Flags [.], seq 1859:3287, ack 5522, win 4096, options [nop,nop,TS val 64986579 ecr 560634454], length 1428
23:02:33.174731 IP 192.168.0.101.59642 > 13.107.18.11.https: Flags [P.], seq 3287:4113, ack 5522, win 4096, options [nop,nop,TS val 64986579 ecr 560634454], length 826
23:02:33.198859 IP 13.107.18.11.https > 192.168.0.101.59642: Flags [.], ack 393, win 1028, options [nop,nop,TS val 560634479 ecr 64986578], length 0
23:02:33.198861 IP 13.107.18.11.https > 192.168.0.101.59642: Flags [P.], seq 5522:5560, ack 393, win 1028, options [nop,nop,TS val 560634479 ecr 64986578], length 38
23:02:33.198900 IP 192.168.0.101.59642 > 13.107.18.11.https: Flags [.], ack 5560, win 4094, options [nop,nop,TS val 64986602 ecr 560634479], length 0
23:02:33.199003 IP 13.107.18.11.https > 192.168.0.101.59642: Flags [.], ack 431, win 1028, options [nop,nop,TS val 560634480 ecr 64986579], length 0
23:02:33.200380 IP 13.107.18.11.https > 192.168.0.101.59642: Flags [.], ack 1859, win 1029, options [nop,nop,TS val 560634480 ecr 64986579], length 0
23:02:33.200383 IP 13.107.18.11.https > 192.168.0.101.59642: Flags [.], ack 3287, win 1023, options [nop,nop,TS val 560634480 ecr 64986579], length 0
23:02:33.200383 IP 13.107.18.11.https > 192.168.0.101.59642: Flags [.], ack 4113, win 1029, options [nop,nop,TS val 560634480 ecr 64986579], length 0
23:02:33.401660 IP 192.168.0.101.59635 > ec2-54-148-61-193.us-west-2.compute.amazonaws.com.https: Flags [S], seq 1417370303, win 65535, options [mss 1460,nop,wscale 5,nop,nop,TS val 64986786 ecr 0,sackOK,eol], length 0
23:02:33.423374 IP 13.107.18.11.https > 192.168.0.101.59642: Flags [P.], seq 5560:5817, ack 4113, win 1029, options [nop,nop,TS val 560634703 ecr 64986602], length 257
23:02:33.423414 IP 192.168.0.101.59642 > 13.107.18.11.https: Flags [.], ack 5817, win 4087, options [nop,nop,TS val 64986806 ecr 560634703], length 0
23:02:33.434707 IP 192.168.0.101.59642 > 13.107.18.11.https: Flags [.], seq 4113:5541, ack 5817, win 4096, options [nop,nop,TS val 64986816 ecr 560634703], length 1428
23:02:33.434736 IP 192.168.0.101.59642 > 13.107.18.11.https: Flags [.], seq 5541:6969, ack 5817, win 4096, options [nop,nop,TS val 64986816 ecr 560634703], length 1428
23:02:33.434758 IP 192.168.0.101.59642 > 13.107.18.11.https: Flags [P.], seq 6969:7795, ack 5817, win 4096, options [nop,nop,TS val 64986816 ecr 560634703], length 826
23:02:33.460318 IP 13.107.18.11.https > 192.168.0.101.59642: Flags [.], ack 5541, win 1023, options [nop,nop,TS val 560634740 ecr 64986816], length 0
23:02:33.460324 IP 13.107.18.11.https > 192.168.0.101.59642: Flags [.], ack 6969, win 1029, options [nop,nop,TS val 560634740 ecr 64986816], length 0
23:02:33.460325 IP 13.107.18.11.https > 192.168.0.101.59642: Flags [.], ack 7795, win 1026, options [nop,nop,TS val 560634740 ecr 64986816], length 0
23:02:33.585945 IP 192.168.0.101.59631 > ec2-54-148-61-193.us-west-2.compute.amazonaws.com.https: Flags [S], seq 2621248403, win 65535, options [mss 1460,nop,wscale 5,nop,nop,TS val 64986957 ecr 0,sackOK,eol], length 0
23:02:33.681370 IP 13.107.18.11.https > 192.168.0.101.59642: Flags [P.], seq 5817:5927, ack 7795, win 1026, options [nop,nop,TS val 560634961 ecr 64986816], length 110
23:02:33.681412 IP 192.168.0.101.59642 > 13.107.18.11.https: Flags [.], ack 5927, win 4092, options [nop,nop,TS val 64987045 ecr 560634961], length 0
23:02:33.702157 IP 192.168.0.101.59644 > 40.100.29.18.https: Flags [S], seq 990656855, win 65535, options [mss 1460,nop,wscale 5,nop,nop,TS val 64987065 ecr 0,sackOK,eol], length 0
23:02:33.743382 IP 40.100.29.18.https > 192.168.0.101.59644: Flags [S.], seq 3329957891, ack 990656856, win 8190, options [mss 1460,nop,wscale 4,nop,nop,sackOK], length 0
23:02:33.743422 IP 192.168.0.101.59644 > 40.100.29.18.https: Flags [.], ack 1, win 8192, length 0
23:02:33.743549 IP 192.168.0.101.59644 > 40.100.29.18.https: Flags [P.], seq 1:217, ack 1, win 8192, length 216
23:02:33.782867 IP 192.168.0.101.59632 > ec2-54-148-61-193.us-west-2.compute.amazonaws.com.https: Flags [S], seq 2522174445, win 65535, options [mss 1460,nop,wscale 5,nop,nop,TS val 64987140 ecr 0,sackOK,eol], length 0
23:02:33.784649 IP 40.100.29.18.https > 192.168.0.101.59644: Flags [.], ack 217, win 680, length 0
23:02:33.787624 IP 40.100.29.18.https > 192.168.0.101.59644: Flags [.], ack 217, win 65535, length 0
23:02:33.788002 IP 40.100.29.18.https > 192.168.0.101.59644: Flags [.], seq 1:1461, ack 217, win 65535, length 1460
23:02:33.788003 IP 40.100.29.18.https > 192.168.0.101.59644: Flags [.], seq 1461:2921, ack 217, win 65535, length 1460
23:02:33.788042 IP 192.168.0.101.59644 > 40.100.29.18.https: Flags [.], ack 2921, win 8100, length 0
23:02:33.788066 IP 192.168.0.101.59644 > 40.100.29.18.https: Flags [.], ack 2921, win 8192, length 0
23:02:33.788399 IP 40.100.29.18.https > 192.168.0.101.59644: Flags [P.], seq 2921:3892, ack 217, win 65535, length 971
23:02:33.788418 IP 192.168.0.101.59644 > 40.100.29.18.https: Flags [.], ack 3892, win 8161, length 0
23:02:33.789079 IP 192.168.0.101.59644 > 40.100.29.18.https: Flags [P.], seq 217:343, ack 3892, win 8192, length 126
23:02:33.831010 IP 40.100.29.18.https > 192.168.0.101.59644: Flags [P.], seq 3892:3943, ack 343, win 65535, length 51
23:02:33.831049 IP 192.168.0.101.59644 > 40.100.29.18.https: Flags [.], ack 3943, win 8190, length 0
23:02:33.834821 IP 192.168.0.101.59644 > 40.100.29.18.https: Flags [P.], seq 343:748, ack 3943, win 8192, length 405
23:02:33.876817 IP 40.100.29.18.https > 192.168.0.101.59644: Flags [P.], seq 3943:4352, ack 748, win 65535, length 409
23:02:33.876854 IP 192.168.0.101.59644 > 40.100.29.18.https: Flags [.], ack 4352, win 8179, length 0
23:02:33.884752 IP 192.168.0.101.59644 > 40.100.29.18.https: Flags [P.], seq 748:1153, ack 4352, win 8192, length 405
23:02:33.927017 IP 40.100.29.18.https > 192.168.0.101.59644: Flags [P.], seq 4352:4761, ack 1153, win 65535, length 409
23:02:33.927047 IP 192.168.0.101.59644 > 40.100.29.18.https: Flags [.], ack 4761, win 8179, length 0
23:02:33.945340 IP 192.168.0.101.59645 > 13.107.6.163.https: Flags [SEW], seq 2081408831, win 65535, options [mss 1460,nop,wscale 5,nop,nop,TS val 64987287 ecr 0,sackOK,eol], length 0
23:02:33.972848 IP 13.107.6.163.https > 192.168.0.101.59645: Flags [S.E], seq 3121791101, ack 2081408832, win 8192, options [mss 1440,nop,wscale 8,sackOK,TS val 569216661 ecr 64987287], length 0
23:02:33.972902 IP 192.168.0.101.59645 > 13.107.6.163.https: Flags [.], ack 1, win 4105, options [nop,nop,TS val 64987312 ecr 569216661], length 0
23:02:33.973032 IP 192.168.0.101.59645 > 13.107.6.163.https: Flags [P.], seq 1:199, ack 1, win 4105, options [nop,nop,TS val 64987312 ecr 569216661], length 198
23:02:33.999613 IP 13.107.6.163.https > 192.168.0.101.59645: Flags [.], ack 199, win 1029, options [nop,nop,TS val 569216688 ecr 64987312], length 0
23:02:34.002164 IP 13.107.6.163.https > 192.168.0.101.59645: Flags [.], seq 1:1449, ack 199, win 1029, options [nop,nop,TS val 569216690 ecr 64987312], length 1448
23:02:34.002166 IP 13.107.6.163.https > 192.168.0.101.59645: Flags [.], seq 1449:2897, ack 199, win 1029, options [nop,nop,TS val 569216690 ecr 64987312], length 1448
23:02:34.002206 IP 192.168.0.101.59645 > 13.107.6.163.https: Flags [.], ack 2897, win 4015, options [nop,nop,TS val 64987338 ecr 569216690], length 0
23:02:34.002313 IP 13.107.6.163.https > 192.168.0.101.59645: Flags [.], seq 2897:4345, ack 199, win 1029, options [nop,nop,TS val 569216690 ecr 64987312], length 1448
23:02:34.002314 IP 13.107.6.163.https > 192.168.0.101.59645: Flags [P.], seq 4345:5735, ack 199, win 1029, options [nop,nop,TS val 569216690 ecr 64987312], length 1390
23:02:34.002353 IP 192.168.0.101.59645 > 13.107.6.163.https: Flags [.], ack 5735, win 4007, options [nop,nop,TS val 64987338 ecr 569216690], length 0
23:02:34.003085 IP 192.168.0.101.59645 > 13.107.6.163.https: Flags [P.], seq 199:292, ack 5735, win 4096, options [nop,nop,TS val 64987338 ecr 569216690], length 93
23:02:34.007501 IP 192.168.0.101.59645 > 13.107.6.163.https: Flags [P.], seq 292:385, ack 5735, win 4096, options [nop,nop,TS val 64987342 ecr 569216690], length 93
23:02:34.007673 IP 192.168.0.101.59645 > 13.107.6.163.https: Flags [P.], seq 385:1237, ack 5735, win 4096, options [nop,nop,TS val 64987342 ecr 569216690], length 852
23:02:34.029840 IP 13.107.6.163.https > 192.168.0.101.59645: Flags [.], ack 292, win 1029, options [nop,nop,TS val 569216718 ecr 64987338], length 0
23:02:34.030094 IP 13.107.6.163.https > 192.168.0.101.59645: Flags [P.], seq 5735:5786, ack 292, win 1029, options [nop,nop,TS val 569216719 ecr 64987338], length 51
23:02:34.030138 IP 192.168.0.101.59645 > 13.107.6.163.https: Flags [.], ack 5786, win 4094, options [nop,nop,TS val 64987362 ecr 569216719], length 0
23:02:34.030352 IP 13.107.6.163.https > 192.168.0.101.59645: Flags [P.], seq 5786:5855, ack 292, win 1029, options [nop,nop,TS val 569216719 ecr 64987338], length 69
23:02:34.030383 IP 192.168.0.101.59645 > 13.107.6.163.https: Flags [.], ack 5855, win 4093, options [nop,nop,TS val 64987362 ecr 569216719], length 0
23:02:34.030468 IP 192.168.0.101.59645 > 13.107.6.163.https: Flags [P.], seq 1237:1275, ack 5855, win 4096, options [nop,nop,TS val 64987362 ecr 569216719], length 38
23:02:34.034880 IP 13.107.6.163.https > 192.168.0.101.59645: Flags [.], ack 385, win 1028, options [nop,nop,TS val 569216724 ecr 64987342], length 0
23:02:34.035121 IP 13.107.6.163.https > 192.168.0.101.59645: Flags [P.], seq 5855:5893, ack 1237, win 1025, options [nop,nop,TS val 569216724 ecr 64987342], length 38
23:02:34.035155 IP 192.168.0.101.59645 > 13.107.6.163.https: Flags [.], ack 5893, win 4094, options [nop,nop,TS val 64987366 ecr 569216724], length 0
23:02:34.036961 IP 13.107.6.163.https > 192.168.0.101.59645: Flags [P.], seq 5893:6128, ack 1237, win 1025, options [nop,nop,TS val 569216726 ecr 64987342], length 235
23:02:34.036963 IP 13.107.6.163.https > 192.168.0.101.59645: Flags [P.], seq 6128:6166, ack 1237, win 1025, options [nop,nop,TS val 569216726 ecr 64987342], length 38
23:02:34.036993 IP 192.168.0.101.59645 > 13.107.6.163.https: Flags [.], ack 6128, win 4088, options [nop,nop,TS val 64987368 ecr 569216726], length 0
23:02:34.037005 IP 192.168.0.101.59645 > 13.107.6.163.https: Flags [.], ack 6166, win 4087, options [nop,nop,TS val 64987368 ecr 569216726], length 0
23:02:34.057598 IP 13.107.6.163.https > 192.168.0.101.59645: Flags [.], ack 1275, win 1025, options [nop,nop,TS val 569216746 ecr 64987362], length 0
23:02:34.271273 IP 192.168.0.101.59647 > 199.16.199.50.https: Flags [SEW], seq 2038251609, win 65535, options [mss 1460,nop,wscale 5,nop,nop,TS val 64987578 ecr 0,sackOK,eol], length 0
23:02:34.496344 IP 192.168.0.101.59635 > ec2-54-148-61-193.us-west-2.compute.amazonaws.com.https: Flags [S], seq 1417370303, win 65535, options [mss 1460,nop,wscale 5,nop,nop,TS val 64987786 ecr 0,sackOK,eol], length 0
23:02:34.520033 IP 199.16.199.50.https > 192.168.0.101.59647: Flags [S.E], seq 1653184014, ack 2038251610, win 28960, options [mss 1460,sackOK,TS val 3484066407 ecr 64987578,nop,wscale 7], length 0
23:02:34.520075 IP 192.168.0.101.59647 > 199.16.199.50.https: Flags [.], ack 1, win 4117, options [nop,nop,TS val 64987808 ecr 3484066407], length 0
23:02:34.520448 IP 192.168.0.101.59647 > 199.16.199.50.https: Flags [P.], seq 1:206, ack 1, win 4117, options [nop,nop,TS val 64987808 ecr 3484066407], length 205
23:02:34.773719 IP 199.16.199.50.https > 192.168.0.101.59647: Flags [.], ack 206, win 235, options [nop,nop,TS val 3484066653 ecr 64987808], length 0
23:02:34.773722 IP 199.16.199.50.https > 192.168.0.101.59647: Flags [P.], seq 1:143, ack 206, win 235, options [nop,nop,TS val 3484066654 ecr 64987808], length 142
23:02:34.773812 IP 192.168.0.101.59647 > 199.16.199.50.https: Flags [.], ack 143, win 4113, options [nop,nop,TS val 64988040 ecr 3484066654], length 0
23:02:34.774101 IP 192.168.0.101.59647 > 199.16.199.50.https: Flags [P.], seq 206:592, ack 143, win 4113, options [nop,nop,TS val 64988040 ecr 3484066654], length 386
23:02:35.059319 IP 199.16.199.50.https > 192.168.0.101.59647: Flags [.], ack 592, win 243, options [nop,nop,TS val 3484066947 ecr 64988040], length 0
23:02:35.070688 IP 199.16.199.50.https > 192.168.0.101.59647: Flags [P.], seq 143:560, ack 592, win 243, options [nop,nop,TS val 3484066958 ecr 64988040], length 417
23:02:35.070748 IP 192.168.0.101.59647 > 199.16.199.50.https: Flags [.], ack 560, win 4100, options [nop,nop,TS val 64988312 ecr 3484066958], length 0
23:02:35.071442 IP 192.168.0.101.59647 > 199.16.199.50.https: Flags [P.], seq 592:855, ack 560, win 4100, options [nop,nop,TS val 64988312 ecr 3484066958], length 263
23:02:35.317565 IP 199.16.199.50.https > 192.168.0.101.59647: Flags [.], ack 855, win 252, options [nop,nop,TS val 3484067205 ecr 64988312], length 0
23:02:35.318408 IP 199.16.199.50.https > 192.168.0.101.59647: Flags [P.], seq 560:791, ack 855, win 252, options [nop,nop,TS val 3484067206 ecr 64988312], length 231
23:02:35.318494 IP 192.168.0.101.59647 > 199.16.199.50.https: Flags [.], ack 791, win 4093, options [nop,nop,TS val 64988535 ecr 3484067206], length 0
23:02:35.319036 IP 192.168.0.101.59647 > 199.16.199.50.https: Flags [P.], seq 855:886, ack 791, win 4096, options [nop,nop,TS val 64988536 ecr 3484067206], length 31
23:02:35.319168 IP 192.168.0.101.59647 > 199.16.199.50.https: Flags [F.], seq 886, ack 791, win 4096, options [nop,nop,TS val 64988536 ecr 3484067206], length 0
23:02:35.565009 IP 199.16.199.50.https > 192.168.0.101.59647: Flags [F.], seq 791, ack 886, win 252, options [nop,nop,TS val 3484067452 ecr 64988536], length 0
23:02:35.565012 IP 199.16.199.50.https > 192.168.0.101.59647: Flags [.], ack 887, win 252, options [nop,nop,TS val 3484067452 ecr 64988536], length 0
23:02:35.565087 IP 192.168.0.101.59647 > 199.16.199.50.https: Flags [F.], seq 886, ack 792, win 4096, options [nop,nop,TS val 64988768 ecr 3484067452], length 0
23:02:35.583999 IP 192.168.0.101.59635 > ec2-54-148-61-193.us-west-2.compute.amazonaws.com.https: Flags [S], seq 1417370303, win 65535, options [mss 1460,nop,wscale 5,nop,nop,TS val 64988786 ecr 0,sackOK,eol], length 0
23:02:35.757955 IP 192.168.0.101.59631 > ec2-54-148-61-193.us-west-2.compute.amazonaws.com.https: Flags [S], seq 2621248403, win 65535, options [mss 1460,nop,wscale 5,nop,nop,TS val 64988957 ecr 0,sackOK,eol], length 0
23:02:35.954936 IP 192.168.0.101.59632 > ec2-54-148-61-193.us-west-2.compute.amazonaws.com.https: Flags [S], seq 2522174445, win 65535, options [mss 1460,nop,wscale 5,nop,nop,TS val 64989140 ecr 0,sackOK,eol], length 0
23:02:37.694865 IP 192.168.0.101.59635 > ec2-54-148-61-193.us-west-2.compute.amazonaws.com.https: Flags [S], seq 1417370303, win 65535, options [mss 1460,nop,wscale 5,nop,nop,TS val 64990786 ecr 0,sackOK,eol], length 0
23:02:38.642883 IP 192.168.0.101.49828 > maa03s29-in-f14.1e100.net.https: UDP, length 1350
23:02:38.643139 IP 192.168.0.101.59650 > maa03s29-in-f14.1e100.net.https: Flags [S], seq 3591496586, win 65535, options [mss 1460,nop,wscale 5,nop,nop,TS val 64991716 ecr 0,sackOK,eol], length 0
23:02:38.644873 IP 192.168.0.101.62289 > maa03s29-in-f14.1e100.net.https: UDP, length 1350
23:02:38.645147 IP 192.168.0.101.59651 > maa03s29-in-f14.1e100.net.https: Flags [SEW], seq 2761198833, win 65535, options [mss 1460,nop,wscale 5,nop,nop,TS val 64991718 ecr 0,sackOK,eol], length 0
23:02:38.645603 IP 192.168.0.101.49828 > maa03s29-in-f14.1e100.net.https: UDP, length 391
23:02:38.651844 IP maa03s29-in-f14.1e100.net.https > 192.168.0.101.59650: Flags [S.], seq 535544804, ack 3591496587, win 42408, options [mss 1380,sackOK,TS val 1337785874 ecr 64991716,nop,wscale 8], length 0
23:02:38.651881 IP 192.168.0.101.59650 > maa03s29-in-f14.1e100.net.https: Flags [.], ack 1, win 4104, options [nop,nop,TS val 64991724 ecr 1337785874], length 0
23:02:38.652678 IP 192.168.0.101.59650 > maa03s29-in-f14.1e100.net.https: Flags [P.], seq 1:200, ack 1, win 4104, options [nop,nop,TS val 64991724 ecr 1337785874], length 199
23:02:38.653547 IP maa03s29-in-f14.1e100.net.https > 192.168.0.101.59651: Flags [S.], seq 1114928362, ack 2761198834, win 42408, options [mss 1380,sackOK,TS val 1226426103 ecr 64991718,nop,wscale 8], length 0
23:02:38.653579 IP 192.168.0.101.59651 > maa03s29-in-f14.1e100.net.https: Flags [.], ack 1, win 4104, options [nop,nop,TS val 64991725 ecr 1226426103], length 0
23:02:38.653680 IP 192.168.0.101.59651 > maa03s29-in-f14.1e100.net.https: Flags [P.], seq 1:204, ack 1, win 4104, options [nop,nop,TS val 64991725 ecr 1226426103], length 203
23:02:38.661090 IP maa03s29-in-f14.1e100.net.https > 192.168.0.101.59650: Flags [.], ack 200, win 170, options [nop,nop,TS val 1337785884 ecr 64991724], length 0
23:02:38.661937 IP maa03s29-in-f14.1e100.net.https > 192.168.0.101.59651: Flags [.], ack 204, win 170, options [nop,nop,TS val 1226426111 ecr 64991725], length 0
23:02:38.676402 IP maa03s29-in-f14.1e100.net.https > 192.168.0.101.49828: UDP, length 35
23:02:38.680224 IP maa03s29-in-f14.1e100.net.https > 192.168.0.101.62289: UDP, length 35
23:02:38.683203 IP maa03s29-in-f14.1e100.net.https > 192.168.0.101.49828: UDP, length 1350
23:02:38.683408 IP maa03s29-in-f14.1e100.net.https > 192.168.0.101.49828: UDP, length 1350
23:02:38.685585 IP 192.168.0.101.49828 > maa03s29-in-f14.1e100.net.https: UDP, length 1350
23:02:38.685636 IP 192.168.0.101.49828 > maa03s29-in-f14.1e100.net.https: UDP, length 387
23:02:38.685979 IP maa03s29-in-f14.1e100.net.https > 192.168.0.101.62289: UDP, length 1350
23:02:38.686582 IP maa03s29-in-f14.1e100.net.https > 192.168.0.101.62289: UDP, length 1350
23:02:38.688376 IP 192.168.0.101.62289 > maa03s29-in-f14.1e100.net.https: UDP, length 1350
23:02:38.695383 IP maa03s29-in-f14.1e100.net.https > 192.168.0.101.49828: UDP, length 35
23:02:38.695386 IP maa03s29-in-f14.1e100.net.https > 192.168.0.101.59650: Flags [.], seq 1:1419, ack 200, win 170, options [nop,nop,TS val 1337785917 ecr 64991724], length 1418
23:02:38.695510 IP maa03s29-in-f14.1e100.net.https > 192.168.0.101.59650: Flags [.], seq 1419:2837, ack 200, win 170, options [nop,nop,TS val 1337785917 ecr 64991724], length 1418
23:02:38.695512 IP maa03s29-in-f14.1e100.net.https > 192.168.0.101.59650: Flags [.], seq 2837:4255, ack 200, win 170, options [nop,nop,TS val 1337785917 ecr 64991724], length 1418
23:02:38.695514 IP maa03s29-in-f14.1e100.net.https > 192.168.0.101.59650: Flags [P.], seq 4255:4366, ack 200, win 170, options [nop,nop,TS val 1337785917 ecr 64991724], length 111
23:02:38.695552 IP 192.168.0.101.59650 > maa03s29-in-f14.1e100.net.https: Flags [.], ack 2837, win 4051, options [nop,nop,TS val 64991765 ecr 1337785917], length 0
23:02:38.695580 IP 192.168.0.101.59650 > maa03s29-in-f14.1e100.net.https: Flags [.], ack 4366, win 4048, options [nop,nop,TS val 64991765 ecr 1337785917], length 0
23:02:38.695698 IP maa03s29-in-f14.1e100.net.https > 192.168.0.101.59651: Flags [.], seq 1:1419, ack 204, win 170, options [nop,nop,TS val 1226426144 ecr 64991725], length 1418
23:02:38.695731 IP maa03s29-in-f14.1e100.net.https > 192.168.0.101.59651: Flags [.], seq 1419:2837, ack 204, win 170, options [nop,nop,TS val 1226426144 ecr 64991725], length 1418
23:02:38.695769 IP 192.168.0.101.59651 > maa03s29-in-f14.1e100.net.https: Flags [.], ack 2837, win 4015, options [nop,nop,TS val 64991765 ecr 1226426144], length 0
23:02:38.696013 IP maa03s29-in-f14.1e100.net.https > 192.168.0.101.59651: Flags [.], seq 2837:4255, ack 204, win 170, options [nop,nop,TS val 1226426144 ecr 64991725], length 1418
23:02:38.696016 IP maa03s29-in-f14.1e100.net.https > 192.168.0.101.59651: Flags [P.], seq 4255:4368, ack 204, win 170, options [nop,nop,TS val 1226426144 ecr 64991725], length 113
23:02:38.696071 IP 192.168.0.101.59651 > maa03s29-in-f14.1e100.net.https: Flags [.], ack 4368, win 3967, options [nop,nop,TS val 64991765 ecr 1226426144], length 0
23:02:38.696763 IP 192.168.0.101.59650 > maa03s29-in-f14.1e100.net.https: Flags [P.], seq 200:293, ack 4366, win 4096, options [nop,nop,TS val 64991766 ecr 1337785917], length 93
23:02:38.698064 IP 192.168.0.101.59651 > maa03s29-in-f14.1e100.net.https: Flags [.], ack 4368, win 4096, options [nop,nop,TS val 64991767 ecr 1226426144], length 0
23:02:38.698920 IP 192.168.0.101.59651 > maa03s29-in-f14.1e100.net.https: Flags [P.], seq 204:462, ack 4368, win 4096, options [nop,nop,TS val 64991767 ecr 1226426144], length 258
23:02:38.701500 IP 192.168.0.101.62289 > maa03s29-in-f14.1e100.net.https: UDP, length 1350
23:02:38.705502 IP maa03s29-in-f14.1e100.net.https > 192.168.0.101.59650: Flags [P.], seq 4366:4650, ack 293, win 170, options [nop,nop,TS val 1337785928 ecr 64991766], length 284
23:02:38.705505 IP maa03s29-in-f14.1e100.net.https > 192.168.0.101.59650: Flags [P.], seq 4650:4719, ack 293, win 170, options [nop,nop,TS val 1337785928 ecr 64991766], length 69
23:02:38.705548 IP 192.168.0.101.59650 > maa03s29-in-f14.1e100.net.https: Flags [.], ack 4650, win 4087, options [nop,nop,TS val 64991774 ecr 1337785928], length 0
23:02:38.705562 IP 192.168.0.101.59650 > maa03s29-in-f14.1e100.net.https: Flags [.], ack 4719, win 4084, options [nop,nop,TS val 64991774 ecr 1337785928], length 0
23:02:38.707875 IP maa03s29-in-f14.1e100.net.https > 192.168.0.101.59651: Flags [P.], seq 4368:4689, ack 462, win 175, options [nop,nop,TS val 1226426157 ecr 64991767], length 321
23:02:38.707908 IP 192.168.0.101.59651 > maa03s29-in-f14.1e100.net.https: Flags [.], ack 4689, win 4085, options [nop,nop,TS val 64991776 ecr 1226426157], length 0
23:02:38.708102 IP maa03s29-in-f14.1e100.net.https > 192.168.0.101.59651: Flags [P.], seq 4689:4758, ack 462, win 175, options [nop,nop,TS val 1226426157 ecr 64991767], length 69
23:02:38.708133 IP 192.168.0.101.59651 > maa03s29-in-f14.1e100.net.https: Flags [.], ack 4758, win 4083, options [nop,nop,TS val 64991776 ecr 1226426157], length 0
23:02:38.710274 IP maa03s29-in-f14.1e100.net.https > 192.168.0.101.62289: UDP, length 38
23:02:38.726207 IP maa03s29-in-f14.1e100.net.https > 192.168.0.101.49828: UDP, length 1350
23:02:38.726213 IP maa03s29-in-f14.1e100.net.https > 192.168.0.101.49828: UDP, length 31
